question_id,question,category
316,"What are your career plans for the next five years?","Future Plans"
317,"Are you planning to move to a different home?","Future Plans"
318,"When do you plan to have children?","Future Plans"
319,"Do you plan to travel or take vacations in the near future?","Future Plans"
320,"Are you planning to continue your education?","Future Plans"
321,"Do you intend to buy property together?","Future Plans"
322,"Do you plan to start a business together?","Future Plans"
323,"Are you considering relocating to a different city or state?","Future Plans"
324,"Do you plan to apply for citizenship when eligible?","Future Plans"
